data_cadastro;sinopse;diretor_norm;titulo_norm;decada
2010-07-07 12:40:20;O que são tribos? Como se formam? Você faz parte de alguma delas?;ELEN CRISTINA DE MARSELHA SILVA GLAUBER ALVES DA SILVA JULIANA CRISTINA DE MOURA MAX PAULO DA S FONSECA PAULA SCHNAIDER DE OLIVEIRA;TRIBOS OF KINO;2010
2010-07-07 13:13:22;As idéias que originaram a criação do samba de enredo da escola de samba União Imperial.;ADILIO GONCALVES LUIZ PAULO DA SILVA PAULO HENRIQUE DA COSTA RAFAEL RODRIGO DE ARAUJO VEIRA WELLINGTON VALDEVINO NOBERO;O ENREDO DO MEU SAMBA;2010
2010-07-07 14:21:19;Documentário sobre a ala das baianas da escola de samba União Imperial, grupo de acesso do carnaval paulistano.;CRISTINA ADELINA DE ASSUNCAO DANILO CRUZ DAINEZI DILVANIA FERREIRA DE SANTANA FERNANDA DOS SANTOS RIBEIRO;RODA BAIANA OF KINO;2010
2010-07-07 14:34:56;A história do bairro de Perus, desde o início do século passado.;CATIA BORGES DIANE DOURADO LAZARO REIS TALITA MARIA DA SILVA THAYS SOUZA;O RESGATE DE PERUS OF KINO;2010
2010-07-07 14:44:52;Video-clipe que discute sons e imagens de um transeunte do centrão de São Paulo.;CARLOS AUGUSTO RODRIGUES EDUARDO LISBOA FABIO OLIVEIRA JORGE APARECIDO RICARDO VIEIRA RICHELIO PEREIRA;O MINGAU QUE VIROU TUTU OF KINO;2010
2010-07-07 14:49:54;"Sexo; prazer e comércio no centro de São Paulo, do ponto de vista de 4 jovens realizadoras.";ANDREIA FRANCO LOANE CIBELE REGINA ALBANO THAIS SILVESTRE;VITRINE DO PRAZER OF KINO;2010
2010-07-07 14:55:56;Como suportar a violência familiar?;EVANDRO S ALVES HELOISA PEREIRA CASSIANO LETICIA RODRIGUES FAUSTINO GOMES RAFAEL H CARMARGO SABRINA SANTOS COSTA;CONTRARIANDO AS ESTATISTICAS OF KINO;2010
2010-07-07 15:07:21;Jovem sonha em conseguir seu próprio carro.;ALINE SILVA DIEGO LEMOS DE JESUS EWERTON LUIZ LIDIANE MARTINS FERREIRA RENATA AGUDO ROBSON LIMA;AUTO DE AZAR OF KINO;2010
2010-07-07 15:17:32;Uma hilariante versão do conto da Chapeuzinho Vermelho.;LILIAN PIRES PENHA YASLINE DOMINGOS FELIX YASMIN CRISTINA DOMINGOS FELIX;CHAPEUZINHO CONTROVERSO OF KINO;2010
2010-08-06 12:36:22;Um Tênis e uma Sandália desaparecem da sapateira causando uma reviravolta na casa onde viviam Peixe Pablo, os Sapatos e a Menina.;NAIARA RIMOLI;NA CASA AO LADO;2010
2010-08-06 12:36:58;Esquecida pelo seu pai na saída da aula de balé, Carolina se vê encorajada por um amigo a tentar ir pra casa sozinha – uma aventura na qual enfrentará seus medos e encontrará curiosos personagens.;PAULA SANTOS;DIREITA E A MAO QUE VOCE ESCREVE;2010
2010-07-07 15:46:41;Em um lugar repleto de natureza, muitas historias se escondem por tras desta bela paisagem.;ALINE CRISTIANE VIEIRA DA COSTA ANDRE AQUILES PEREIRA GIANNICARIO LEONARDO SILVA MAIZA DA MOTA CASTRO NATTANA VAZ COSTA PRISCILA TOMAS DE SENA;CONTOS DA GRUTA OF KINO;2010
2010-07-07 16:09:52;Uma mãe que quando jovem sonhava em ser modelo, uma filha disposta a tudo para realizar o sonho, custe o que custar...;BARBARA LUCIA ABREU SIQUEIRA GISLAINE CAMILA DUARTE LEANDRO MENDES BASSI LUANA VEIRA DE OLIVEIRA;TRANSTORNO OF KINO;2010
2010-07-07 16:20:14;Comédia sobre garota que, depois de assistir um filme sobre ETs, acaba se transformando em um deles.;JESSICA NAYARA COELHO GOMES JOAO VITOR ALVES DA ROCHA MARIANE BARROQUEL SILVA MARIANE LUIZA ZUIM NATHALIA ANGELICA SILVA;DE REPENTE E T OF KINO;2010
2010-07-07 16:25:15;Garotas vindas de diferentes lugares desaparecem para encontrarem-se em um espaço inesperado.;ANAMARIA FERREIRA LUCENA FERNANDO AUGUSTO PAVAM LUANA DA FONSECA ROQUE MELISSA MACIEL CENACHI PALOMA RABASSI;VERACIDADE OF KINO;2010
2010-07-07 16:32:21;Documentário sobre a Fazenda Ermida, uma construção do início do século passado, um dos marcos na história de Jundiaí-SP.;GABRIEL DA SILVA GERGYE JOAO MARCOS LACERDA DOS SANTOS LUIS EDUARDO CARDOSO CARREIRO MAGNILSON REIS MARCOS OTAVIO APARECIDO BERNARDES;FAZENDA ERMIDA;2010
2010-07-08 11:52:17;Fagner vendia planos de saúde pelo telefone. Valéria trabalha há 19 anos numa das maiores centrais de teleatendimento do país. O telemarketing é o setor da economia que mais cresce e contrata hoje no Brasil com cerca de 700 mil operadores. Alguns deles estão neste filme. Inspirado na reportagem publicada na revista piauí.;ANGELO DEFANTI;BOM DIA MEU NOME E SHEILA OU COMO TRABALHAR EM TELEMARKETING E GANHAR UM VALE COXINHA;2010
2010-07-08 20:35:07;Cinco câmeras, cinco cidades, uma noite e seus restos.;CRISTINA MAURE E PABLO LOBATO;RESTOS;2010
2010-07-08 20:51:52;Em um ambiente muito seco, onde a água é escassa, mulheres vivem entre crianças e outras mulheres.;CRISTINA MAURE E JOANA OLIVEIRA;RIO DE MULHERES;2010
2010-07-09 11:22:33;O documentário EIXO convida a uma viagem por Goiânia passando pela Avenida Anhanguera, o Centro e outros bairros da Capital. Observando o vaivém diário e registrando histórias de personagens que têm o Eixo Anhanguera presente em suas vidas, o filme propõe uma reflexão sobre a vida nos corredores de transporte, a movimentação humana nos centros urbanos, seus encontros e desencontros.;ULIANA DUARTE;EIXO;2010
2010-07-09 11:38:52;Homem espera trem numa estação abandonada, no entanto o trem parou de passar por ali há mais de 10 anos. Mas o Homem não desiste e todo o dia no mesmo horário fica a sua espera, até que um dia o trem realmente passa.;ALAN MINAS;O APITO;2010
2010-07-09 14:27:25;"""Thomaz Farkas, Brasileiro"" faz uma homenagem ao húngaro que se tornou um dos maiores fotógrafos do nosso país e um expoente da história do documentário brasileiro. Com sua visão muito particular do Brasil, foi capaz de produzir, ao lado de Geraldo Sarno e outros grandes diretores da época, uma série de documentários intitulada ""A Condição Brasileira"".";WALTER LIMA JUNIOR;THOMAZ FARKAS BRASILEIRO;2010
2010-07-09 15:20:26;Um filme rodado no carnaval! Sem roteiro, sem claquete e sem fotômetro!;LEONARDO ESTEVES;ALGUEM TEM QUE HONRAR ESSA DERROTA;2010
2010-07-09 15:34:35;A renovação constante e a necessidade permanente do homem de se expressar são forças que movem a sociedade. Multiplicadores é um documentário sobre a cultura do Grafite, e tem como foco principal o seu caráter de mobilização e inclusão social no estado do Rio de Janeiro. ;RENATO MARTINS;MULTIPLICADORES;2010
2010-07-09 17:46:35;" Reporter de TV acha, casualmente, nos ""Achados e Perdidos"" do metrô, uma carta de amor endereçada a uma mulher, há mais de 50 anos, investiga sua tragetória real e improvável, desencadeando uma série de acontecimentos imprevistos e revelando uma estória cheia de sentimentos esquecidos.";EDUARDO ALBERGARIA;ACHADOS E PERDIDOS;2010
2010-07-10 12:11:04;"O vídeo documentário O Apóstolo do Sertão registra através de depoimentos de familiares, ex funcionários e populares que conviveram com o Dr. Ferreira, como era popularmente conhecido, um pouco da vida e dos feitos de um dos maiores empreendedores do Sertão paraibano. Nascido em Nova York EUA, Dr. José Rodrigues Ferreira chegou ao Sertão do Ceará em 1915 e a Paraíba em 1932, sendo proprietário da Fazenda Acauã onde instalou inúmeros dos seus experimentos no campo da agricultura, da bovinocultura e da indústria. Foi também um homem de prestígio político e se destacou pelo profundo conhecimento da Doutrina Espírita, dedicando seus últimos dias de vida ao tratamento dos \""loucos\"", considerados por ele como “doentes espirituais” na sua Fazenda Acauã, onde preces e assistência material e espiritual de Dr. Ferreira e de seus familiares produziam curas e melhoras acentuadas.";LAERCIO FILHO;O APOSTOLO DO SERTAO;2010
2010-07-11 16:09:29;"A memória de uma geração visitada por seus personagens. O cenário é o centro de uma grande cidade; o enredo a urgência da vida. E o Bailão o ponto de convergência dessas histórias.";MARCELO CAETANO;BAILAO;2010
2010-07-12 01:11:25;Moça cega salva rapaz de atropelamento. Iniciam, assim, um conturbado relacionamento.;GUSTAVO ACIOLI;CAO GUIA;2010
2010-07-12 01:26:11;Numa noite de apagão, revelam-se as relações entre um casal e seu bebê.;GUSTAVO ACIOLI;NUMA NOITE QUALQUER;2010
2010-07-12 01:54:59;Retrato da elite brasileira através de um artista em estado crítico.;GUSTAVO ACIOLI;NADA A DECLARAR;2010
2010-07-12 02:10:23;Através de uma colagem de diálogos de Platão, o filme constrói uma desconcertante parábola sobre o Brasil.;GUSTAVO ACIOLI;MORA NA FILOSOFIA;2010
2010-07-12 10:09:05;"Niterói é uma cidade abastada de talentos de artes plásticas. E do mar vem muito da inspiração. Foi entre os anos de 1884 e 1886, impulsionada por um grupo de sete jovens artistas liderados pelo pintor alemão Georg Grimm (1846 – 1887), que se impôs a escola paisagista que se tornou a mais forte manifestação artística da cidade e que mudaria o panorama da arte brasileira. Foi esse grupo, mais tarde chamado \""Grupo Grimm\"", advindo da Academia Imperial de Belas Artes e exilado em Niterói, que implantou como método nas artes plásticas brasileiras o uso da paisagem real como inspiração (plaine aire). Destaca-se então Antônio Parreiras (1860 – 1937), que monta atelier na cidade e através de seus ensinamentos forma discípulos e uma escola de pintores dedicados às marinhas e ao paisagismo. Mas e as gerações de hoje? Como se expressam? O que significa para elas o mar?";FLAVIO CANDIDO;AS ARTES QUE VEM DO MAR;2010
2010-07-12 10:21:43;A narrativa de Um Dia Como Hoje tem início em um bar, onde o casal de protagonistas, interpretado por Carolina Sudati e Julio Andrade, apresentam graves problemas de entendimento. Aos poucos, os diálogos vão revelando indícios da vida pregressa do casal, seus conflitos, angústias e a própria condição social que os leva a abandonar o pouco que tinham e tentar a sorte em um outro lugar.;EDUARDO WANNMACHER;UM DIA COMO HOJE;2010
2010-07-12 10:52:04;Algo está causando uma reviravolta na vida de Camila. Ela se deu conta de que não é mais aquela menininha que adorava brincar de boneca. Algumas coisas diferentes estão acontecendo com o seu corpo e mexendo com ela. Por isso, tantas horas na frente do espelho, tantas horas tentando entender o que passa, já que ninguém a entende. Nem a mãe, nem as amigas e muito menos os meninos. Ah, os meninos...;AMADEU ALBAN;CAMILA E O ESPELHO;2010
2010-07-12 11:03:02;Sensações Contrárias é ambientado no Recôncavo Baiano, região de passado coronelista. Dentro de um ambiente provinciano-decadente, desenvolve-se a noção de borrão, em que os eventos coreográficos e imagéticos se dão por aparentes acidentes, falhas e descontinuidades, num limite entre realismo cotidiano e surrealismo. ;AMADEU ALBAN;SENSACOES CONTRARIAS;2010
2010-07-12 11:17:43;Um dia na vida de um garoto que mora no subúrbio ferroviário de Salvador e trabalha como guardador de carros no centro histórico. ;CESAR FERNANDO DE OLIVEIRA;10 CENTAVOS;2010
2010-07-12 11:36:16;Calangos e Calangueiros é um documentário musical e caipira que tem por matéria prima uma de nossas mais ricas e negligenciadas tradições artísticas: o calango, verso e canto de desafio do sudeste brasileiro. O filme caminha pelo vale do rio Paraíba do Sul com o mestre Alcides Isaú em busca do paradeiro do calango e dos calangueiros e revela essa tradição poética e musical da roça brasileira contando com a participação de mais de 80 calangueiros de Minas Gerais, Rio de Janeiro e São Paulo.;FLAVIO CANDIDO;CALANGOS E CALANGUEIROS UMA VIAGEM CAIPIRA PELO VALE DO PARAIBA;2010
2010-07-12 11:52:30;O término de uma relação amorosa é o estopim para essa emocionante e delicada história, baseada na música “Livros no Quintal” de Vítor Ramil, adaptada no roteiro de Vinícius Cruxen. Livros no Quintal é um curta-metragem cheio de sentimentos conflitantes e reflexões, expondo em sua máxima analogia o conflito existencial do “ser artista”.Sônia, uma escritora homossexual, é a personagem que nos conduz por essa trama. Ela apresenta em um dia o desespero de uma mulher oprimida pelo seu contexto social, seu ambiente e sua arte. O resultado é a destruição total do seu apartamento, na busca de um alívio inexistente, na purificação interna e de tudo que a envolve.;VINICIUS CRUXEN;LIVROS NO QUINTAL;2010
2010-07-12 16:41:08;Em 1955, a jovem Ingrid começa a trabalhar na livraria Machado de Assis, onde conhece Silvia, a gerente. O que poderia ser um encontro casual vai influenciar as escolhas que moldarão seu futuro de forma importante e duradoura.;MONICA PALAZZO;PAGINAS DE MENINA;2010
2010-07-12 16:49:49;"Do Lat. Implacabile. Que se não pode aplacar; que não perdoa; inexorável; insensível; inflexível.Caminhando há dias por uma estrada deserta, um homem depara-se com uma bifurcação. Já não é possível apenas seguir. A placa lhe indica: é preciso escolher um caminho.";PEDRO STRUCHI;IMPLACAVEL;2010
2010-07-12 17:11:32;Um típico almoço de domingo entre amigos: maridos entretidos com o futebol, pequenas discussões com os filhos, esposas levemente alteradas. Até que alguns segredinhos são revelados, entre eles um sonho erótico capaz de mudar o rumo dessa prosa;RODRIGO DIAZ DIAZ;DEPOIS DO ALMOCO;2010
2010-07-12 17:21:07;O cotidiano de quase meio milhão de pessoas que dependem do trem para se transportar de suas casas, na periferia leste da grande São Paulo, ao trabalho, na capital paulista. ;ESTER FER E PIETRO PICOLOMINI;VARIANTE;2010
2010-07-12 18:54:51;Reflexão sobre loucura, arte e a mente humana a partir de depoimentos de pessoas com transtornos psíquicos. Desconexão poética entre imagem e som.;ANNA COSTA E SILVA FABIO CANETTI E LUIZA SANTOLONI;VOZES;2010
2010-07-12 20:38:10;poema Hai Kai através dos quatro elementos da natureza: terra, fogo, ar e água.;FRANCISCO DE PAULA;HAI KAI;2010
2010-07-12 20:56:46;as guerras no campo, pela posse da terra basileira: Contestado- santa catarina, Canudos- Bahia, Cangaço, nordeste. e o palhaço do camponês tratado como bandido. ;FRANCISCO DE PAULA;PRIMAVERA;2010
2010-07-12 22:14:58; crianças pobres, sem escola e sem família, nas ruas da cidade do Rio de Janeiro.;FRANCISCO DE PAULA;AS ANDORINHAS;2010
2010-07-12 22:25:41;os primeiros cem anos do cinema brasileiro. ;FRANCISCO DE PAULA;CELEBRACAO 100 ANOS DE CINEMA;2010
2010-07-13 00:13:55;mais um encontro entre as minorias étnicas, em busca do sonho de povos unidos.;FRANCISCO DE PAULA;POVOS UNIDOS PARTE 2;2010
2010-07-13 00:20:12;poemas de Cecília Meirelles sobre a cidade do RIo de Janeiro;FRANCISCO DE PAULA;ENTUSIASMO E FOME;2010
2010-07-13 00:24:27;encontro de crianças de minorias étnicas, numa floresta perto daqui.;FRANCISCO DE PAULA;POVOS UNIDOS;2010
2010-07-14 13:15:55;Um documentário sobre uma cidade e sua alma. A presença da vida e da morte nos centros urbanos contemporâneos. Uma reflexão sobre as raízes das cidades e os sentimentos de seus habitantes.;MARCOS PIMENTEL;URBE;2010
2010-07-14 13:23:00;Um dia qualquer, uma cidade comum.O horror e o sublime do urbano em constante transformação, numa era onde não há nada acabado, definitivo. Construção e destruição, sístole e diástole expressas na poética da pólis contemporânea.;MARCOS PIMENTEL;POLIS;2010
2010-07-14 13:33:56;Taba: coletivo de oca. Sobre os escombros e destroços das cidades contemporâneas, os novos guerreiros urbanos improvisam diariamente por ruas e ruínas... Representantes de diferentes tribos experimentam suas guerras cotidianas pela sobrevivência habitando um território desigual e em contínuo desequilíbrio. Um documentário que desnuda os contrastes e contradições que a vida na cidade nos reserva. ;MARCOS PIMENTEL;TABA;2010
2010-08-06 12:39:12;Aos quinze anos, Rafael é um adolescente como muitos outros – até que o skate que ganha da namorada muda o rumo de sua história.;MARIA CAMARGO;O CORACAO AS VEZES PARA DE BATER;2010
2010-08-06 12:41:02;Que belos tempos quando a gente pegava o bonde para ir à escola, ao trabalho, a todos os lugares. Até esses ônibus barulhentos chegarem.;ROGERIO NUNES;BAILARINO E O BONDE;2010
2010-08-06 12:41:29;Um jovem boxeador perde uma luta no dia do aniversário do filho. A imagem do herói que o garoto projetava no pai é abalada e os dois terão de administrar esse acontecimento.;LEONARDO WITTMANN;O BOXEADOR;2010
2010-08-06 12:43:45;De forma lúdica, o vídeo oferece uma resposta científica a uma curiosidade bastante simples de uma criança: o que o nosso corpo faz para que a gente cresça e se modifique?;MATEUS DI MAMBRO;O QUE NOSSO CORPO FAZ PARA QUE A GENTE CRESCA E SE MODIFIQUE;2010
2010-08-06 12:44:56;Francisco combina um piquenique com sua vizinha, Bianca, para fazer um trabalho de ciências. No caminho para o encontro, Francisco encontra dois amigos e, com vergonha de dizer que ia encontrar uma garota, acaba indo jogar futebol com os meninos. Quando Francisco decide ir ao encontro de Bianca, ela está decepcionada e ele tenta uma reconciliação.;FERNANDA BOFF E VINICIUS BOCK;CAMINHOS;2010
2010-08-06 12:45:54;Em algum lugar do nordeste, Zé é um homem comum e preguiçoso, com três filhos e uma mulher furiosa que necessitam comer. Com muita esperança Zé e o seu fiel escudeiro, o cachorro, desbravam a seca em busca de alimento.;DANIEL LUIZ BATISTA;E AGORA O QUE NOIS RAMU CUME;2010
2010-08-06 12:48:29;Tinho conhece Stephanie. Uma amizade se inicia.;CLAUDIO MARQUES E MARILIA HUGHES;CARRETO;2010
2010-08-06 12:48:34;Uma fábula sobre anjos caídos, sonhos esquecidos e um menino.;ALE CAMARGO E CAMILA CARROSSINE;OS ANJOS DO MEIO DA PRACA;2010
2010-08-06 12:50:56;Vivi é uma garotinha de sete anos, espirituosa e muito curiosa, que vive em uma infinita busca por Viravento, lugar secreto revelado por sua avó Rosa Rara, uma famosa escritora. A partir das anotações feitas em seu inseparável diário, Vivi acaba encontrando novas pistas para Viravento e vivendo grandes aventuras em busca deste mundo mágico. Como companhia, a menina tem os amigos e companheiros de aventuras: Mochilão, que cheio de palavras quase sempre fica para trás no corre-corre da aventura, e Laterninha, o desbravador.A cada episódio, Vivi viaja para um lugar do mundo e quase encontra Viviravento, mas o que ela não percebe é que a Viravento não está localizada em um determinado local geográfico. É antes um estado de espírito, livre e criativo. Assim, na medida em que a aventura imaginada e anotada no diário é assistida, o espectador entra em contato com o registro de suas primeiras experimentações poéticas e literárias.;ALE ABREU;VIVI VIRAVENTO;2010
2010-08-06 12:52:04;Os donos do cão de apartamento Bolota prepararam um carreteiro que o deixou salivando, mas que ele não pode experimentar. Percebendo a tristeza do amigo que só come ração, a gata Chumbrega convida o cão e o hamster VonVon para uma aventura: viajar até uma chácara para provar o melhor carreteiro. Chumbrega encontra na casa um guarda-chuva que, magicamente, voa.;FREDERICO PINTO;BOLOTA CHUMBREGA UM GUARDA CHUVA MUITO ESPECIAL;2010
2010-08-06 12:53:32;Uma mensagem com uma profecia escrita por guardiães da terra mágica chamada Asgard afirma que o garoto Matheus se tornará um guerreiro adulto, assim que iniciada a próxima aurora. Com pouco tempo para saber o que fazer, Matheus recorre ao seu maior oráculo – seu pai – para aprender as artimanhas da vida adulta e seguir com seu destino.;GIU JORGE;A PROFECIA DE ASGARD;2010
2010-08-06 13:03:27;Godofredo é um ogro curioso que encontra um interruptor no caminho.;EVA FURNARI;GODOFREDO O INTERRUPTOR;2010
2010-08-06 14:47:18;Juju e sua bola cor de chiclete, um pacote com muitos chicletes de várias cores, e uma bola de chiclete da cor da bola da Juju. Esta confusão vai parar no brejo!;EDUARDO DRACHINSKI;DOCE TURMINHA E A BOLA COR DE CHICLETE;2010
2010-08-06 15:17:00;A partir da descoberta de uma antiga fita cassete, a personagem revive seu passado e, por meio dos ruídos, sons e da musicalidade, reencontra seu cotidiano e seu convívio afetuoso com a empregada doméstica.;DANIELA MARINHO;FEIJAO COM ARROZ;2010
2010-08-06 15:18:44;Uma família comum sai para férias convencionais, mas a vida é extraordinária e cheia de surpresas.;ARNALDO GALVAO;MINHAS FERIAS;2010
2010-08-06 15:21:06;Marcos é um garoto que acorda um dia e descobre que está… com mofo! O filme aborda com bom humor e fantasia o excesso de proteção com que são tratados os jovens da classe média de hoje, com os medos e paranóias gerados pela violência existente nas grandes cidades.;ANDRE PELLENZ;O MENINO MOFADO;2010
2010-08-06 15:23:59;O cabelo, a fronteira final. Entre caretas e escovas, as viagens de uma menina em busca de aceitação.;ALEXANDRE BERSOT;IMAGINE UMA MENINA COM CABELOS DE BRASIL;2010
2011-08-11 12:35:15;Em uma conversa de botequim, músico ingênuo aceita um trabalho que parece ser a maior furada. Mas sua alegria vai contagiando a todos por onde passa e assim vai vivendo situações inusitadas pelos botequins tradicionais do Rio de Janeiro à procura de um misterioso Zé.;BERNARDO GEBARA;SAMBA NO BOTEQUIM DO SEU ZE;2010
2010-08-06 15:27:27;Godofredo é um ogro que sonha que voa.;EVA FURNARI;GODOFREDO NHACT;2010
2010-08-06 15:29:22;Dois meninos e uma menina estão pichando o bairro do Jardim São Marcos. Encontram para pichar o muro do cemitério. É quando conhecerão o Fantasma da pá…;MAURICIO SQUARISI E WILSON LAZARETTI;A SOMBRA MISTERIOSA;2010
2010-08-06 15:31:29;"O amor invade a casa da Família Brasil: o Neto está apaixonado pela professora da escola e o Filho por uma colega de aula; enquanto o Pai e a Mãe tentam resolver os amores da juventude, a Filha e Boca têm seus próprios conflitos amorosos.";MARCIO SCHOENARDIE;FAMILIA A GENTE NAO ESCOLHE;2010
2010-08-06 15:33:22;De forma lúdica o vídeo oferece uma resposta científica a uma curiosidade bastante simples de uma criança: de onde vem a nossa voz?;MATEUS DI MAMBRO;DE ONDE VEM A NOSSA VOZ;2010
2010-08-06 15:35:23;Três crianças tentam desvendar uma antiga lenda local.;IGOR SPACEK E IVAN SPACEK;LINGUA LIVRE;2010
2010-08-06 15:46:43;Uma velha curandeira de uma pacata cidade do interior encontra um menino mágico foragido do circo.;ADRIANA MEIRELLES;DONA TOTA E O MENINO MAGICO;2010
2010-08-06 16:54:30;A história de um pintinho discriminado por dois pássaros devido à sua incapacidade de voar. Ele supera o preconceito graças a uma surpresa do acaso.;NATALIA CRISTINE ALENCAR DE FREITAS;LEVE VOO;2010
2010-08-06 15:53:59;O Cãodog descobre um método para ensinar a voar e arma uma banca para vender seus serviços. O Gatobiruta, quando lê o cartaz, cai na gargalhada, pois acha que tudo aquilo é uma invenção muito maluca. Porém o Ratoloko, que sonha em aprender a voar, acredita na ideia e paga para aprender.;PAULO JOSE ANIMADOR;DOIDITO APRENDENDO A VOAR;2010
2010-08-06 15:57:53;No antigo mundo neolítico um garoto observa seu tempo. Os rastros que ele deixa em sua caverna são interpretados por um arqueólogo que, nem sempre, acerta na teoria.;PAULO MIRANDA;RUPESTRE;2010
2010-08-06 15:58:30;Caetano sonha em ser cantor de rádio na década de 50 e foge todas as noites de casa para tentar, sem sucesso, a sorte no programa de calouros. Até que, uma noite, ele aposta tudo numa louca e definitiva performance.;CECI ALVES;DOIDO LELE;2010
2010-08-06 15:59:42;Teo é um garotinho que não gosta de tomar banho. Apesar da grande resistência do filho, dona Carmem redobra esforços para que ele mantenha bons hábitos de higiene. A situação se complica quando os colegas de escola começam a estranhar os costumes nada higiênicos do garoto.;ANDRE RODRIGUES;TEO E SUA TURMA EM O MENINO QUE NAO GOSTAVA DE TOMAR BANHO;2010
2010-08-06 16:01:06;A história de Pebeu, um menino de 10 anos que decide viver primitivamente como seus antepassados, causando surpresa a sua mãe.;CINEMA NOSSO;O PRIMITIVO;2010
2010-08-06 16:01:56;Ian é um garoto de 10 anos que vive entre dois mundos extremos: Bobolândia e Monstrolândia. Trata-se de uma cidade mágica com duas facetas, uma durante o dia e outra, à noite.;ALE MCHADDO;BOBOLANDIA E MONSTROLANDIA;2010
2010-08-06 16:03:34;Segundo a Astrologia, o Retorno de Saturno é um período de grandes mudanças na vida de uma pessoa. É o que acontece com um homem que perde o emprego, fica sem namorada e com três filhos para cuidar.;LISANDRO SANTOS;O RETORNO DE SATURNO;2010
2010-08-06 16:05:16;Godofredo é um ogro curioso que encontra um rádio no caminho.;EVA FURNARI;GODOFREDO O RADIO;2010
2010-08-06 16:06:04;Adolescente relembra de sua infância quando abre uma antiga caixa de brinquedos.;CINEMA NOSSO;INFANCIA;2010
2010-08-06 16:06:35;Pedro não deixa Joana participar de suas brincadeiras de menino, Joana zomba quando Pedro chora como uma menina. As diferenças entre meninos e meninas são fontes permanentes de discórdia entre os irmãos até que, quando passam juntos debaixo de um arco-íris, Pedro se transfere para o corpo de Joana e Joana se descobre no corpo de Pedro.;ANTONIO CARLOS DA FONTOURA;FACA SEM PONTA GALINHA SEM PE;2010
2010-08-06 16:08:30;Nika Valente, Bob Água, Frida Flor, Fred Fauno e Max Limpo usam seus “super poderes” contra os “vilões da natureza”, representados por Dick Poluição e Poli Vigarista. De uma maneira fácil e divertida, as crianças aprendem conceitos como a importância das matas ciliares, da reciclagem e do reflorestamento.;SILVIA PRADO;CRIANCA ECOLOGICA;2010
2010-08-06 16:09:39;Fábula sobre uma criança que, devido a uma rara doença, tem barba. Felipe gosta de ser como é, mas se sente deslocado porque as outras pessoas costumam olhar para ele de forma diferente. Quando seus pais resolvem submetê-lo a uma moderna cirurgia de remoção de pêlos, será preciso que o garoto tome uma decisão drástica, que mostrará aos seus pais e à cidade inteira que, às vezes, vale a pena lutar pelo o que se é realmente.;CHRISTOPHER FAUST;GAROTO BARBA;2010
